<?xml version="1.0" encoding="utf-8"?>
<!DOCTYPE chemical_element_list SYSTEM "chemical_elements.dtd">
<chemical_element_list>
	<chemical_element symbol="Am">
		<name val="Americium"/>
		<abundance val="100"/>
		<atomic_weight val="243.0613727"/>
		<nucleons val="-1"/>
		<electrons val="95"/>
		<neutron_scattering_length>
			<coherent re="8.3"/>
			<incoherent re="2"/>
		</neutron_scattering_length>
		<neutron_scattering_cross_section>
			<coherent re="8.7"/>
			<incoherent re="0.3"/>
			<total val="9"/>
			<absorption val="75.3"/>
		</neutron_scattering_cross_section>
	</chemical_element>
	<chemical_element symbol="Am">
		<name val="Americium"/>
		<abundance val="0"/>
		<atomic_weight val="243.0613727"/>
		<nucleons val="243"/>
		<electrons val="95"/>
		<neutron_scattering_length>
			<coherent re="8.3"/>
			<incoherent re="2"/>
		</neutron_scattering_length>
		<neutron_scattering_cross_section>
			<coherent re="8.7"/>
			<incoherent re="0.3"/>
			<total val="9"/>
			<absorption val="75.3"/>
		</neutron_scattering_cross_section>
	</chemical_element>
</chemical_element_list>
